{"entries":[{"catalog":"CWE","id":"CWE-1004","title":"Sensitive Cookie Without 'HttpOnly' Flag","version":"4.20"},{"catalog":"CWE","id":"CWE-1007","title":"Insufficient Visual Distinction of Homoglyphs Presented to User","version":"4.20"},{"catalog":"CWE","id":"CWE-102","title":"Struts: Duplicate Validation Forms","version":"4.20"},{"catalog":"CWE","id":"CWE-1021","title":"Improper Restriction of Rendered UI Layers or Frames","version":"4.20"},{"catalog":"CWE","id":"CWE-1022","title":"Use of Web Link to Untrusted Target with window.opener Access","version":"4.20"},{"catalog":"CWE","id":"CWE-1023","title":"Incomplete Comparison with Missing Factors","version":"4.20"},{"catalog":"CWE","id":"CWE-1024","title":"Comparison of Incompatible Types","version":"4.20"},{"catalog":"CWE","id":"CWE-1025","title":"Comparison Using Wrong Factors","version":"4.20"},{"catalog":"CWE","id":"CWE-103","title":"Struts: Incomplete validate() Method Definition","version":"4.20"},{"catalog":"CWE","id":"CWE-1037","title":"Processor Optimization Removal or Modification of Security-critical Code","version":"4.20"},{"catalog":"CWE","id":"CWE-1038","title":"Insecure Automated Optimizations","version":"4.20"},{"catalog":"CWE","id":"CWE-1039","title":"Inadequate Detection or Handling of Adversarial Input Perturbations in Automated Recognition Mechanism","version":"4.20"},{"catalog":"CWE","id":"CWE-104","title":"Struts: Form Bean Does Not Extend Validation Class","version":"4.20"},{"catalog":"CWE","id":"CWE-1041","title":"Use of Redundant Code","version":"4.20"},{"catalog":"CWE","id":"CWE-1042","title":"Static Member Data Element outside of a Singleton Class Element","version":"4.20"},{"catalog":"CWE","id":"CWE-1043","title":"Data Element Aggregating an Excessively Large Number of Non-Primitive Elements","version":"4.20"},{"catalog":"CWE","id":"CWE-1044","title":"Architecture with Number of Horizontal Layers Outside of Expected Range","version":"4.20"},{"catalog":"CWE","id":"CWE-1045","title":"Parent Class with a Virtual Destructor and a Child Class without a Virtual Destructor","version":"4.20"},{"catalog":"CWE","id":"CWE-1046","title":"Creation of Immutable Text Using String Concatenation","version":"4.20"},{"catalog":"CWE","id":"CWE-1047","title":"Modules with Circular Dependencies","version":"4.20"},{"catalog":"CWE","id":"CWE-1048","title":"Invokable Control Element with Large Number of Outward Calls","version":"4.20"},{"catalog":"CWE","id":"CWE-1049","title":"Excessive Data Query Operations in a Large Data Table","version":"4.20"},{"catalog":"CWE","id":"CWE-105","title":"Struts: Form Field Without Validator","version":"4.20"},{"catalog":"CWE","id":"CWE-1050","title":"Excessive Platform Resource Consumption within a Loop","version":"4.20"},{"catalog":"CWE","id":"CWE-1051","title":"Initialization with Hard-Coded Network Resource Configuration Data","version":"4.20"},{"catalog":"CWE","id":"CWE-1052","title":"Excessive Use of Hard-Coded Literals in Initialization","version":"4.20"},{"catalog":"CWE","id":"CWE-1053","title":"Missing Documentation for Design","version":"4.20"},{"catalog":"CWE","id":"CWE-1054","title":"Invocation of a Control Element at an Unnecessarily Deep Horizontal Layer","version":"4.20"},{"catalog":"CWE","id":"CWE-1055","title":"Multiple Inheritance from Concrete Classes","version":"4.20"},{"catalog":"CWE","id":"CWE-1056","title":"Invokable Control Element with Variadic Parameters","version":"4.20"},{"catalog":"CWE","id":"CWE-1057","title":"Data Access Operations Outside of Expected Data Manager Component","version":"4.20"},{"catalog":"CWE","id":"CWE-1058","title":"Invokable Control Element in Multi-Thread Context with non-Final Static Storable or Member Element","version":"4.20"},{"catalog":"CWE","id":"CWE-1059","title":"Insufficient Technical Documentation","version":"4.20"},{"catalog":"CWE","id":"CWE-106","title":"Struts: Plug-in Framework not in Use","version":"4.20"},{"catalog":"CWE","id":"CWE-1060","title":"Excessive Number of Inefficient Server-Side Data Accesses","version":"4.20"},{"catalog":"CWE","id":"CWE-1061","title":"Insufficient Encapsulation","version":"4.20"},{"catalog":"CWE","id":"CWE-1062","title":"Parent Class with References to Child Class","version":"4.20"},{"catalog":"CWE","id":"CWE-1063","title":"Creation of Class Instance within a Static Code Block","version":"4.20"},{"catalog":"CWE","id":"CWE-1064","title":"Invokable Control Element with Signature Containing an Excessive Number of Parameters","version":"4.20"},{"catalog":"CWE","id":"CWE-1065","title":"Runtime Resource Management Control Element in a Component Built to Run on Application Servers","version":"4.20"},{"catalog":"CWE","id":"CWE-1066","title":"Missing Serialization Control Element","version":"4.20"},{"catalog":"CWE","id":"CWE-1067","title":"Excessive Execution of Sequential Searches of Data Resource","version":"4.20"},{"catalog":"CWE","id":"CWE-1068","title":"Inconsistency Between Implementation and Documented Design","version":"4.20"},{"catalog":"CWE","id":"CWE-1069","title":"Empty Exception Block","version":"4.20"},{"catalog":"CWE","id":"CWE-107","title":"Struts: Unused Validation Form","version":"4.20"},{"catalog":"CWE","id":"CWE-1070","title":"Serializable Data Element Containing non-Serializable Item Elements","version":"4.20"},{"catalog":"CWE","id":"CWE-1071","title":"Empty Code Block","version":"4.20"},{"catalog":"CWE","id":"CWE-1072","title":"Data Resource Access without Use of Connection Pooling","version":"4.20"},{"catalog":"CWE","id":"CWE-1073","title":"Non-SQL Invokable Control Element with Excessive Number of Data Resource Accesses","version":"4.20"},{"catalog":"CWE","id":"CWE-1074","title":"Class with Excessively Deep Inheritance","version":"4.20"},{"catalog":"CWE","id":"CWE-1075","title":"Unconditional Control Flow Transfer outside of Switch Block","version":"4.20"},{"catalog":"CWE","id":"CWE-1076","title":"Insufficient Adherence to Expected Conventions","version":"4.20"},{"catalog":"CWE","id":"CWE-1077","title":"Floating Point Comparison with Incorrect Operator","version":"4.20"},{"catalog":"CWE","id":"CWE-1078","title":"Inappropriate Source Code Style or Formatting","version":"4.20"},{"catalog":"CWE","id":"CWE-1079","title":"Parent Class without Virtual Destructor Method","version":"4.20"},{"catalog":"CWE","id":"CWE-108","title":"Struts: Unvalidated Action Form","version":"4.20"},{"catalog":"CWE","id":"CWE-1080","title":"Source Code File with Excessive Number of Lines of Code","version":"4.20"},{"catalog":"CWE","id":"CWE-1082","title":"Class Instance Self Destruction Control Element","version":"4.20"},{"catalog":"CWE","id":"CWE-1083","title":"Data Access from Outside Expected Data Manager Component","version":"4.20"},{"catalog":"CWE","id":"CWE-1084","title":"Invokable Control Element with Excessive File or Data Access Operations","version":"4.20"},{"catalog":"CWE","id":"CWE-1085","title":"Invokable Control Element with Excessive Volume of Commented-out Code","version":"4.20"},{"catalog":"CWE","id":"CWE-1086","title":"Class with Excessive Number of Child Classes","version":"4.20"},{"catalog":"CWE","id":"CWE-1087","title":"Class with Virtual Method without a Virtual Destructor","version":"4.20"},{"catalog":"CWE","id":"CWE-1088","title":"Synchronous Access of Remote Resource without Timeout","version":"4.20"},{"catalog":"CWE","id":"CWE-1089","title":"Large Data Table with Excessive Number of Indices","version":"4.20"},{"catalog":"CWE","id":"CWE-109","title":"Struts: Validator Turned Off","version":"4.20"},{"catalog":"CWE","id":"CWE-1090","title":"Method Containing Access of a Member Element from Another Class","version":"4.20"},{"catalog":"CWE","id":"CWE-1091","title":"Use of Object without Invoking Destructor Method","version":"4.20"},{"catalog":"CWE","id":"CWE-1092","title":"Use of Same Invokable Control Element in Multiple Architectural Layers","version":"4.20"},{"catalog":"CWE","id":"CWE-1093","title":"Excessively Complex Data Representation","version":"4.20"},{"catalog":"CWE","id":"CWE-1094","title":"Excessive Index Range Scan for a Data Resource","version":"4.20"},{"catalog":"CWE","id":"CWE-1095","title":"Loop Condition Value Update within the Loop","version":"4.20"},{"catalog":"CWE","id":"CWE-1096","title":"Singleton Class Instance Creation without Proper Locking or Synchronization","version":"4.20"},{"catalog":"CWE","id":"CWE-1097","title":"Persistent Storable Data Element without Associated Comparison Control Element","version":"4.20"},{"catalog":"CWE","id":"CWE-1098","title":"Data Element containing Pointer Item without Proper Copy Control Element","version":"4.20"},{"catalog":"CWE","id":"CWE-1099","title":"Inconsistent Naming Conventions for Identifiers","version":"4.20"},{"catalog":"CWE","id":"CWE-11","title":"ASP.NET Misconfiguration: Creating Debug Binary","version":"4.20"},{"catalog":"CWE","id":"CWE-110","title":"Struts: Validator Without Form Field","version":"4.20"},{"catalog":"CWE","id":"CWE-1100","title":"Insufficient Isolation of System-Dependent Functions","version":"4.20"},{"catalog":"CWE","id":"CWE-1101","title":"Reliance on Runtime Component in Generated Code","version":"4.20"},{"catalog":"CWE","id":"CWE-1102","title":"Reliance on Machine-Dependent Data Representation","version":"4.20"},{"catalog":"CWE","id":"CWE-1103","title":"Use of Platform-Dependent Third Party Components","version":"4.20"},{"catalog":"CWE","id":"CWE-1104","title":"Use of Unmaintained Third Party Components","version":"4.20"},{"catalog":"CWE","id":"CWE-1105","title":"Insufficient Encapsulation of Machine-Dependent Functionality","version":"4.20"},{"catalog":"CWE","id":"CWE-1106","title":"Insufficient Use of Symbolic Constants","version":"4.20"},{"catalog":"CWE","id":"CWE-1107","title":"Insufficient Isolation of Symbolic Constant Definitions","version":"4.20"},{"catalog":"CWE","id":"CWE-1108","title":"Excessive Reliance on Global Variables","version":"4.20"},{"catalog":"CWE","id":"CWE-1109","title":"Use of Same Variable for Multip